<?xml version="1.0" encoding="UTF-8"?>
<!DOCTYPE catalogo SYSTEM "Catalogo_de_Apuestas_Deportivas.dtd">
<catalogo nombre="BetSport Pro" version="2.0">

  <apuesta id="ap001" deporte="Fútbol">
    <titulo>Final Champions League 2025 — Real Madrid vs Manchester City</titulo>
    <descripcion>Gran final de la UEFA Champions League disputada en el Estadio de Wembley. Dos de los clubes más laureados de Europa se enfrentan en busca del título continental.</descripcion>
    <casa_de_apuestas>
      <nombre>Bet365</nombre>
      <pais>Reino Unido</pais>
      <licencia>UK-GC-2024-00312</licencia>
    </casa_de_apuestas>
    <condiciones>
      <fecha_evento>2025-05-31</fecha_evento>
      <mercado nombre_mercado="Resultado Final 1X2">
        <num_selecciones>3</num_selecciones>
        <descripcion_mercado>Apuesta al resultado al final de los 90 minutos: victoria local (1), empate (X) o victoria visitante (2).</descripcion_mercado>
      </mercado>
      <mercado nombre_mercado="Ambos Equipos Marcan">
        <num_selecciones>2</num_selecciones>
        <descripcion_mercado>Predice si ambos equipos anotarán al menos un gol durante el partido.</descripcion_mercado>
      </mercado>
      <mercado nombre_mercado="Total de Goles Más/Menos 2.5">
        <num_selecciones>2</num_selecciones>
        <descripcion_mercado>Indica si el número total de goles será superior o inferior a 2.5 goles.</descripcion_mercado>
      </mercado>
    </condiciones>
  </apuesta>

  <apuesta id="ap002" deporte="Tenis">
    <titulo>Torneo de Wimbledon 2025 — Cuadro Masculino</titulo>
    <descripcion>El torneo de hierba más prestigioso del mundo celebra su 138.ª edición en el All England Club de Londres, con los mejores tenistas del circuito ATP compitiendo por el título.</descripcion>
    <casa_de_apuestas>
      <nombre>William Hill</nombre>
      <pais>España</pais>
      <licencia>DGOJ-APJ-2023-0041</licencia>
    </casa_de_apuestas>
    <condiciones>
      <fecha_evento>2025-06-30</fecha_evento>
      <mercado nombre_mercado="Ganador del Torneo">
        <num_selecciones>32</num_selecciones>
        <descripcion_mercado>Apuesta al jugador que se proclamará campeón de la edición de Wimbledon 2025.</descripcion_mercado>
      </mercado>
      <mercado nombre_mercado="Ganador del Partido — Primera Ronda">
        <num_selecciones>2</num_selecciones>
        <descripcion_mercado>Selecciona qué jugador avanzará a la segunda ronda en cada enfrentamiento individual.</descripcion_mercado>
      </mercado>
    </condiciones>
  </apuesta>

  <apuesta id="ap003" deporte="Baloncesto">
    <titulo>NBA Finals 2025 — Boston Celtics vs Golden State Warriors</titulo>
    <descripcion>La gran final de la NBA enfrenta a los Celtics, vigentes campeones del Este, contra los Warriors, histórica franquicia del Oeste. Serie al mejor de siete partidos.</descripcion>
    <casa_de_apuestas>
      <nombre>Betway</nombre>
      <pais>Malta</pais>
      <licencia>MGA-CRP-2021-00148</licencia>
    </casa_de_apuestas>
    <condiciones>
      <fecha_evento>2025-06-05</fecha_evento>
      <mercado nombre_mercado="Ganador de la Serie">
        <num_selecciones>2</num_selecciones>
        <descripcion_mercado>Apuesta al equipo que ganará el anillo de campeón de la NBA 2025.</descripcion_mercado>
      </mercado>
      <mercado nombre_mercado="Resultado del Partido 1">
        <num_selecciones>2</num_selecciones>
        <descripcion_mercado>Predice quién ganará el primer partido de la serie final.</descripcion_mercado>
      </mercado>
      <mercado nombre_mercado="MVP de las Finales">
        <num_selecciones>10</num_selecciones>
        <descripcion_mercado>Selecciona qué jugador será elegido Jugador Más Valioso de las NBA Finals 2025.</descripcion_mercado>
      </mercado>
    </condiciones>
  </apuesta>

  <apuesta id="ap004" deporte="Fórmula 1">
    <titulo>Gran Premio de Mónaco 2025 — Circuito de Montecarlo</titulo>
    <descripcion>La joya de la corona del automovilismo mundial. El Gran Premio de Mónaco recorre las calles del Principado en una carrera histórica donde el pilotaje técnico es clave.</descripcion>
    <casa_de_apuestas>
      <nombre>Codere</nombre>
      <pais>España</pais>
    </casa_de_apuestas>
    <condiciones>
      <fecha_evento>2025-05-25</fecha_evento>
      <mercado nombre_mercado="Ganador de la Carrera">
        <num_selecciones>20</num_selecciones>
        <descripcion_mercado>Apuesta al piloto que cruzará primero la línea de meta en el GP de Mónaco.</descripcion_mercado>
      </mercado>
      <mercado nombre_mercado="Pole Position">
        <num_selecciones>20</num_selecciones>
        <descripcion_mercado>Predice qué piloto marcará el mejor tiempo en la sesión de clasificación.</descripcion_mercado>
      </mercado>
    </condiciones>
  </apuesta>

  <apuesta id="ap005" deporte="Fútbol">
    <titulo>El Clásico — FC Barcelona vs Real Madrid (LaLiga 2025)</titulo>
    <descripcion>El partido más seguido del mundo enfrenta a los dos grandes del fútbol español en el Camp Nou en una jornada decisiva para el título de LaLiga EA Sports.</descripcion>
    <casa_de_apuestas>
      <nombre>Sportium</nombre>
      <pais>España</pais>
      <licencia>DGOJ-APJ-2022-0078</licencia>
    </casa_de_apuestas>
    <condiciones>
      <fecha_evento>2025-04-26</fecha_evento>
      <mercado nombre_mercado="Resultado Final 1X2">
        <num_selecciones>3</num_selecciones>
        <descripcion_mercado>Apuesta al resultado al final de los 90 minutos reglamentarios del Clásico.</descripcion_mercado>
      </mercado>
      <mercado nombre_mercado="Primer Goleador">
        <num_selecciones>22</num_selecciones>
        <descripcion_mercado>Predice qué jugador marcará el primer gol del encuentro.</descripcion_mercado>
      </mercado>
      <mercado nombre_mercado="Hándicap Asiático">
        <num_selecciones>2</num_selecciones>
        <descripcion_mercado>Apuesta con ventaja o desventaja de goles para equilibrar las probabilidades entre ambos equipos.</descripcion_mercado>
      </mercado>
    </condiciones>
  </apuesta>

  <apuesta id="ap006" deporte="Ciclismo">
    <titulo>Tour de Francia 2025 — Clasificación General</titulo>
    <descripcion>La Grande Boucle celebra su 112.ª edición recorriendo los paisajes más espectaculares de Francia y los Alpes. 21 etapas y más de 3.500 km de competición elite.</descripcion>
    <casa_de_apuestas>
      <nombre>Bwin</nombre>
      <pais>Austria</pais>
      <licencia>AT-GGL-2023-00056</licencia>
    </casa_de_apuestas>
    <condiciones>
      <fecha_evento>2025-07-05</fecha_evento>
      <mercado nombre_mercado="Ganador de la Clasificación General">
        <num_selecciones>25</num_selecciones>
        <descripcion_mercado>Apuesta al ciclista que vestirá el maillot amarillo en los Campos Elíseos al finalizar el Tour.</descripcion_mercado>
      </mercado>
      <mercado nombre_mercado="Ganador de la Etapa 1">
        <num_selecciones>20</num_selecciones>
        <descripcion_mercado>Predice qué corredor se impondrá en la etapa de apertura del Tour de Francia 2025.</descripcion_mercado>
      </mercado>
    </condiciones>
  </apuesta>

</catalogo>
